{
  "schema_version": "competition_scenario_v1",
  "scenario_id": "COMP-EVIDENCESET-001",
  "scenario_type": "MULTI_EVIDENCE_CLAIM_AUDIT",
  "input_identity": {
    "historical_package_id": "phase2-academic-qa-acceptance-v2",
    "historical_package_manifest_sha256": "a8dee26281ee1c953d1024c2686fca28e0d0195855cdde81ed142e791618fd39",
    "source_case_id": "local3.answerable.tracer.ingredients",
    "question_sha256": "0962f57f9558c2279e1505a1ba38452294584d7ba44f61f58a573e1ad9284955",
    "pdf_sha256": "3e7e4628ffadc9183e85341b3a88050c3b58a06dec02926c8f2028b55879d6ea"
  },
  "question": {
    "storage": "RUNTIME_PRIVATE_HISTORICAL_SUITE",
    "tracked_text": false,
    "binding": "question_sha256_and_source_case_id"
  },
  "acceptable_answer_points": [
    "Identify content-aware token surprisal.",
    "Identify situational-awareness indicators for repetition and coherence gaps.",
    "Identify tail-focused aggregation, with every displayed claim bound to returned Evidence."
  ],
  "must_not_claim": [
    "Do not describe EvidenceSet as human semantic Gold or as automatic hallucination elimination.",
    "Do not add a new Judge, retrieve new neighbors, or alter retrieval scores for the audit."
  ],
  "expected_evidence": {
    "document_identity": "doc_arxiv_2602_11409",
    "required_page_ranges": [{"page_start": 1, "page_end": 3}],
    "minimum_evidence_count": 2,
    "minimum_multi_evidence_claim_count": 1,
    "evidence_set_mode": "AUDIT_ONLY"
  },
  "expected_status": "COMPLETED_WITH_MULTI_EVIDENCE_AUDIT_OBSERVED",
  "reproduction": {
    "entrypoint": "deploy/remote/competition-v1/run_competition_pack_v1.ps1",
    "execution_order": 2
  },
  "actual_redacted_result_location": "runtime/competition/v1/<run-id>/redacted-results.json",
  "human_judgment_slot": "evaluation/templates/competition-human-evaluation-v1.csv",
  "known_limitations": [
    "EvidenceSet is deterministic AUDIT_ONLY and does not automatically delete Claims.",
    "The user-run Gate must observe at least one generated Claim bound to multiple returned Evidence; historical QA success alone does not prove this."
  ]
}
